{
  "$schema": "/schemas/registry-v1.json",
  "name": "client",
  "version": "1.0.0",
  "registryVersion": "1.0",
  "generatedAt": "2026-10-10T07:32:32.108Z",
  "description": "Production-grade Expo + React Native boilerplate with multi-tenant SaaS conventions mirroring next-boilerplate.",
  "layers": {
    "app": "Expo Router file-based screens. (group) directories are route groups stripped from URLs. _layout.tsx defines layouts (Stack / Tabs / Slot).",
    "components": "Reusable UI under components/<category>/<Component>.tsx. NativeWind className styling; FontAwesome icons.",
    "services": "Data fetching via services/<module>/*.service.client.ts files. Use axiosInstance from @/libs/axios — never fetch() or ad-hoc axios.",
    "stores": "Zustand stores under stores/<name>Store.ts. Persisted via zustandStorage (MMKV). Never AsyncStorage. Tokens NEVER live in stores.",
    "dtos": "Zod schemas + inferred TS types in services/<module>/<module>.dto.ts. Parse every response with the matching schema; never trust raw JSON.",
    "libs": "Primitives — axios, env (Zod-validated), i18n, logger, mmkv, secureStorage, zustandStorage. Tokens live in SecureStore only."
  },
  "conventions": {
    "routing": "Expo Router v5 file-based. Routes derived from app/ filesystem; (group) segments are stripped. Navigate with router.push/replace or <Link href=\"...\">. Layouts via _layout.tsx.",
    "styling": "NativeWind (Tailwind CSS for React Native). Use className with token utilities. Combine classes via cn() from @/utils/cn. Avoid StyleSheet.create except for dynamic styling.",
    "state": "Zustand 5 + MMKV. Persist via @/libs/zustandStorage. NEVER AsyncStorage. Stores named <name>Store.ts, exporting use<Name>Store.",
    "tokens": "expo-secure-store ONLY (@/libs/secureStorage). Tokens NEVER stored in Zustand or MMKV. axios interceptor injects them at request time.",
    "dataFetch": "Always axiosInstance from @/libs/axios. Never fetch(). Never ad-hoc axios. Auth header (cookie-based) injected by interceptor.",
    "validation": "Zod for every input + every response. DTOs live in services/<module>/<module>.dto.ts; use *.parse() / .safeParse(). Types are z.infer<...>.",
    "icons": "FontAwesome 6 (@fortawesome/react-native-fontawesome + free-solid/free-brands). No expo/vector-icons for new code.",
    "fileNaming": "app/<route>.tsx | app/**/_layout.tsx | components/<cat>/<Pascal>.tsx | services/<module>/<module>.service.client.ts | services/<module>/<module>.dto.ts | stores/<n>Store.ts | libs/<n>.ts | utils/<n>.ts | __tests__/<n>.test.ts(x)"
  },
  "screens": [
    {
      "filePath": "app/_layout.tsx",
      "route": "/_layout",
      "kind": "layout",
      "dynamic": false,
      "layoutChain": []
    },
    {
      "filePath": "app/(auth)/_layout.tsx",
      "route": "/_layout",
      "kind": "layout",
      "group": "auth",
      "dynamic": false,
      "layoutChain": [
        "app/_layout.tsx"
      ]
    },
    {
      "filePath": "app/(auth)/2fa.tsx",
      "route": "/2fa",
      "kind": "screen",
      "group": "auth",
      "dynamic": false,
      "layoutChain": [
        "app/_layout.tsx",
        "app/(auth)/_layout.tsx"
      ]
    },
    {
      "filePath": "app/(auth)/change-password.tsx",
      "route": "/change-password",
      "kind": "screen",
      "group": "auth",
      "dynamic": false,
      "layoutChain": [
        "app/_layout.tsx",
        "app/(auth)/_layout.tsx"
      ]
    },
    {
      "filePath": "app/(auth)/forgot-password.tsx",
      "route": "/forgot-password",
      "kind": "screen",
      "group": "auth",
      "dynamic": false,
      "layoutChain": [
        "app/_layout.tsx",
        "app/(auth)/_layout.tsx"
      ]
    },
    {
      "filePath": "app/(auth)/login.tsx",
      "route": "/login",
      "kind": "screen",
      "group": "auth",
      "dynamic": false,
      "layoutChain": [
        "app/_layout.tsx",
        "app/(auth)/_layout.tsx"
      ]
    },
    {
      "filePath": "app/(auth)/register.tsx",
      "route": "/register",
      "kind": "screen",
      "group": "auth",
      "dynamic": false,
      "layoutChain": [
        "app/_layout.tsx",
        "app/(auth)/_layout.tsx"
      ]
    },
    {
      "filePath": "app/(auth)/reset-password.tsx",
      "route": "/reset-password",
      "kind": "screen",
      "group": "auth",
      "dynamic": false,
      "layoutChain": [
        "app/_layout.tsx",
        "app/(auth)/_layout.tsx"
      ]
    },
    {
      "filePath": "app/(drawer)/_layout.tsx",
      "route": "/_layout",
      "kind": "layout",
      "group": "drawer",
      "dynamic": false,
      "layoutChain": [
        "app/_layout.tsx"
      ]
    },
    {
      "filePath": "app/(drawer)/index.tsx",
      "route": "/",
      "kind": "screen",
      "group": "drawer",
      "dynamic": false,
      "layoutChain": [
        "app/_layout.tsx",
        "app/(drawer)/_layout.tsx"
      ]
    },
    {
      "filePath": "app/(drawer)/messages/_layout.tsx",
      "route": "/messages/_layout",
      "kind": "layout",
      "group": "drawer",
      "dynamic": false,
      "layoutChain": [
        "app/_layout.tsx",
        "app/(drawer)/_layout.tsx"
      ]
    },
    {
      "filePath": "app/(drawer)/messages/[conversationId].tsx",
      "route": "/messages/[conversationId]",
      "kind": "screen",
      "group": "drawer",
      "dynamic": true,
      "layoutChain": [
        "app/_layout.tsx",
        "app/(drawer)/_layout.tsx",
        "app/(drawer)/messages/_layout.tsx"
      ]
    },
    {
      "filePath": "app/(drawer)/messages/index.tsx",
      "route": "/messages",
      "kind": "screen",
      "group": "drawer",
      "dynamic": false,
      "layoutChain": [
        "app/_layout.tsx",
        "app/(drawer)/_layout.tsx",
        "app/(drawer)/messages/_layout.tsx"
      ]
    },
    {
      "filePath": "app/(drawer)/notifications.tsx",
      "route": "/notifications",
      "kind": "screen",
      "group": "drawer",
      "dynamic": false,
      "layoutChain": [
        "app/_layout.tsx",
        "app/(drawer)/_layout.tsx"
      ]
    },
    {
      "filePath": "app/(drawer)/search.tsx",
      "route": "/search",
      "kind": "screen",
      "group": "drawer",
      "dynamic": false,
      "layoutChain": [
        "app/_layout.tsx",
        "app/(drawer)/_layout.tsx"
      ]
    },
    {
      "filePath": "app/(drawer)/settings/_layout.tsx",
      "route": "/settings/_layout",
      "kind": "layout",
      "group": "drawer",
      "dynamic": false,
      "layoutChain": [
        "app/_layout.tsx",
        "app/(drawer)/_layout.tsx"
      ]
    },
    {
      "filePath": "app/(drawer)/settings/change-language.tsx",
      "route": "/settings/change-language",
      "kind": "screen",
      "group": "drawer",
      "dynamic": false,
      "layoutChain": [
        "app/_layout.tsx",
        "app/(drawer)/_layout.tsx",
        "app/(drawer)/settings/_layout.tsx"
      ]
    },
    {
      "filePath": "app/(drawer)/settings/index.tsx",
      "route": "/settings",
      "kind": "screen",
      "group": "drawer",
      "dynamic": false,
      "layoutChain": [
        "app/_layout.tsx",
        "app/(drawer)/_layout.tsx",
        "app/(drawer)/settings/_layout.tsx"
      ]
    },
    {
      "filePath": "app/(drawer)/settings/legal.tsx",
      "route": "/settings/legal",
      "kind": "screen",
      "group": "drawer",
      "dynamic": false,
      "layoutChain": [
        "app/_layout.tsx",
        "app/(drawer)/_layout.tsx",
        "app/(drawer)/settings/_layout.tsx"
      ]
    },
    {
      "filePath": "app/(drawer)/settings/profile.tsx",
      "route": "/settings/profile",
      "kind": "screen",
      "group": "drawer",
      "dynamic": false,
      "layoutChain": [
        "app/_layout.tsx",
        "app/(drawer)/_layout.tsx",
        "app/(drawer)/settings/_layout.tsx"
      ]
    },
    {
      "filePath": "app/(drawer)/settings/security.tsx",
      "route": "/settings/security",
      "kind": "screen",
      "group": "drawer",
      "dynamic": false,
      "layoutChain": [
        "app/_layout.tsx",
        "app/(drawer)/_layout.tsx",
        "app/(drawer)/settings/_layout.tsx"
      ]
    },
    {
      "filePath": "app/(drawer)/settings/sessions.tsx",
      "route": "/settings/sessions",
      "kind": "screen",
      "group": "drawer",
      "dynamic": false,
      "layoutChain": [
        "app/_layout.tsx",
        "app/(drawer)/_layout.tsx",
        "app/(drawer)/settings/_layout.tsx"
      ]
    },
    {
      "filePath": "app/(drawer)/settings/social-accounts.tsx",
      "route": "/settings/social-accounts",
      "kind": "screen",
      "group": "drawer",
      "dynamic": false,
      "layoutChain": [
        "app/_layout.tsx",
        "app/(drawer)/_layout.tsx",
        "app/(drawer)/settings/_layout.tsx"
      ]
    },
    {
      "filePath": "app/(drawer)/settings/tenant/api-keys.tsx",
      "route": "/settings/tenant/api-keys",
      "kind": "screen",
      "group": "drawer",
      "dynamic": false,
      "layoutChain": [
        "app/_layout.tsx",
        "app/(drawer)/_layout.tsx",
        "app/(drawer)/settings/_layout.tsx"
      ]
    },
    {
      "filePath": "app/(drawer)/settings/tenant/audit-log.tsx",
      "route": "/settings/tenant/audit-log",
      "kind": "screen",
      "group": "drawer",
      "dynamic": false,
      "layoutChain": [
        "app/_layout.tsx",
        "app/(drawer)/_layout.tsx",
        "app/(drawer)/settings/_layout.tsx"
      ]
    },
    {
      "filePath": "app/(drawer)/settings/tenant/domains.tsx",
      "route": "/settings/tenant/domains",
      "kind": "screen",
      "group": "drawer",
      "dynamic": false,
      "layoutChain": [
        "app/_layout.tsx",
        "app/(drawer)/_layout.tsx",
        "app/(drawer)/settings/_layout.tsx"
      ]
    },
    {
      "filePath": "app/(drawer)/settings/tenant/index.tsx",
      "route": "/settings/tenant",
      "kind": "screen",
      "group": "drawer",